{
  "schema_version": 1,
  "plan_id": "ctx-plan-1",
  "run_id": "20260518-141522-a3f9b2c1",
  "need_to_inspect": [
    {
      "path": "src/auth/session.ts",
      "reason": "Likely implementation of validateSession",
      "desired_ranges": ["validateSession", "refreshSession"]
    },
    {
      "path": "tests/auth/session.test.ts",
      "reason": "Expected failing test and acceptance behavior",
      "desired_ranges": ["validateSession expiry tests"]
    }
  ],
  "do_not_load": [
    {
      "path": "dist/**",
      "reason": "Generated build output"
    }
  ],
  "estimated_budget": {
    "system": 3800,
    "task": 1200,
    "repo_map": 8200,
    "code_ranges": 12000,
    "tests_logs": 320
  },
  "created_at": "2026-05-18T14:15:20Z"
}
